{
    "$schema": "https://json-schema.org/draft/2020-12/schema",
    "title": "Requirements",
    "type": "object",
    "required": [
        "spec_version",
        "id",
        "title",
        "problem_statement",
        "scope",
        "non_goals",
        "constraints",
        "acceptance_criteria",
        "risks",
        "open_questions"
    ],
    "properties": {
        "spec_version": {
            "type": "string",
            "const": "v1"
        },
        "id": {
            "type": "string"
        },
        "title": {
            "type": "string"
        },
        "problem_statement": {
            "type": "string"
        },
        "scope": {
            "type": "object",
            "additionalProperties": false,
            "required": [
                "in_scope",
                "out_of_scope"
            ],
            "properties": {
                "in_scope": {
                    "type": "array",
                    "items": {
                        "type": "string"
                    }
                },
                "out_of_scope": {
                    "type": "array",
                    "items": {
                        "type": "string"
                    }
                }
            }
        },
        "non_goals": {
            "type": "array",
            "items": {
                "type": "string"
            }
        },
        "constraints": {
            "type": "array",
            "items": {
                "type": "string"
            }
        },
        "acceptance_criteria": {
            "type": "array",
            "items": {
                "type": "string"
            }
        },
        "risks": {
            "type": "array",
            "items": {
                "type": "string"
            }
        },
        "open_questions": {
            "type": "array",
            "items": {
                "type": "string"
            }
        }
    },
    "additionalProperties": false
}